{ "$schema": "https://json-schema.org/draft/2020-12/schema", "title": "StorefrontBuilder AI Inference Log", "type": "object", "required": [ "schemaVersion", "artifactKind", "artifactId", "inferences" ], "properties": { "schemaVersion": { "type": "string" }, "artifactKind": { "const": "ai-inference-log" }, "artifactId": { "type": "string" }, "inferences": { "type": "array" } }, "additionalProperties": true }
